질문 유형,직무 - 회사,질문,답변
기업/아이디어,브랜드마케터 - 마켓컬리,"고객으로서 마켓컬리를 이용해본 적이 있습니까? 
(있을 경우) 본인이 생각하는 마켓컬리는 어떠한 서비스이며 강점과 개선점은 무엇이라고 생각하십니까?","마켓컬리는 ""나를 귀한 사람으로 느끼게 해주는"" 서비스입니다. 
특별한 날, 우울한 날, 축하하고 싶은 날마다 마켓컬리의 서비스를 이용합니다. 컬리 브랜드는 매력적이면서 레어한 상품을 제공하며, 쇼핑하는 나의 가치를 높여줍니다. 새벽 배송 시스템으로 신선한 제품을 하루 만에 받아볼 수 있어, 식품을 구매하며 기대했던 기분을 빠르게 충족시켜 줍니다. ""바쁜 일상 속 건강한 음식을 섭취하며 살아가는 고귀한 나""의 페르소나를 형성하게 해주는 것이 마켓컬리만이 가진 강점이고, 마켓컬리 충성 고객들의 재구매율이 꾸준히 높은 이유라고 생각합니다. 

[강점]
첫째, 마켓컬리의 깔끔하고 매력적인 상품 디자인 화면은 소비자에게 신뢰를 제공합니다. 구매하는 과정에 있어, 후기만큼 중요한 것이 상품 사진과 설명란입니다. 무해하고 건강한 이미지를 느끼게 해주는 상품 사진들과 신뢰감 있는 상품 설명란을 통해 소비자들의 구매율을 높이고, 컬리의 고급스러운 이미지를 만듭니다. 
둘째, 상품 경쟁력입니다. 소비자로서 식료품을 구매하는 데 있어, 가장 중요한 요건은 상품의 질입니다. 상품을 100% 직매입하는 방식을 선택하여 생산자가 재고 없이 제품에만 집중할 수 있도록 만들어줍니다. 마켓컬리는 특정 성분이 들어간 상품은 팔지 않겠다는 기준을 갖고 있습니다. '오렌지 리콜 사례'에서 볼 수 있듯이 고객의 소리를 빠르게 반영하고, 입고분 전체에 대해 적립금으로 환불하는 조치를 통해, 상품에 대한 경쟁력을 높이고 소비자들에게 품질의 신뢰도를 보장합니다.

[개선점]
"" 마켓컬리와 미디어 커머스 시장의 콜라보 "" 
마켓컬리를 이용하며, ""컬리에서 파는 신선한 식재료를 더욱 맛있게 먹는 방법이 무엇이 있을까?"" 고민했습니다. kurly's pick과 같이 레시피가 나와 있는 식재료도 있지만, 다양한 레시피가 없는 상품들도 많습니다. 또한, 레시피가 적혀있더라도 단순히 글로만 설명되어 있어, 실제 적용하기는 어렵습니다. 요리가 서투른 2030, 바쁜 일상으로 인해 포털사이트에서 레시피를 찾기 귀찮은 3040 등 레시피가 필요한 다양한 고객군이 있습니다. 따라서 그들의 수요를 충족할만한 레시피 항목이 추가되어야 한다고 생각합니다.
 비대면 시대를 맞아 미디어 커머스에 대한 수요가 점점 더 높아지고 있습니다. '아내의 식탁' 플랫폼의 경우 국내 최대 레시피 플랫폼으로, 효과적인 음식 콘텐츠를 제공하여 소비자들에게 편의를 제공하며 커머스 분야로도 시장을 확대 중입니다. 마켓컬리는 커머스에 강한 기업이나, 상품 사진의 퀄리티, 대규모의 빅데이터 등을 활용해 충분히 고객의 니즈를 충족하는 레시피 동영상을 만들 수 있습니다. 단순히 글과 사진으로 설명하기보다, 동영상 콘텐츠를 소비자에게 제공할 때, 더욱 소비자의 신뢰도와 편의가 높아질 수 있습니다.
 레시피 콘텐츠의 경우, 두 가지 방법이 있습니다. 첫째, 업계에서 유명한 요리 연구가들을 이용해 콘텐츠를 제작하는 방법입니다. 이는 비용은 많이 들지만, 소비자들의 신뢰도를 높일 수 있습니다. 둘째, 마켓컬리의 상품 고객 후기를 보면, 베스트 후기에 종종 레시피가 함께 올라와 있는 경우가 많습니다. 고객 참여를 통해 레시피를 만들 수 있습니다. 이는 고객 참여도를 높여 더욱 많은 충성고객을 만들 수 있고, 소비자들이 함께 만들어간다는 가치를 제공할 수 있습니다. 
 다양한 온라인 식료품 커머스업체가 경쟁하는 시장 속에서, 미디어 콘텐츠의 제공으로 마켓컬리만의 차별점을 찾을 수 있고, 신규고객의 유입과 기존 고객의 재구매율을 높일 수 있습니다."
협업/성과,마케팅 - 현대백화점,"본인이 주도적으로 팀을 이끌어 목표에 도전해본 경험에 대해 기술해주세요. (쉽지 않은 목표에 도전한 이유, 팀 내 본인의 역할, 도전과정에서 어려웠던 점, 극복한 방법 등)","대학교 3학년때, D.CAMP 스타트업 익스턴십 프로그램에서 와이오엘오 소속으로 해외직구 서비스의 기획 업무를 맡아 팀장으로 팀 빌딩을 수행한 경험이 있습니다. 저희 팀이 직면은 문제는 총 2가지였는데 50만원의 지원금으로 3개월 동안의 기획과 마케팅 활동에 충당해야 하는 것과, 동종 업계의 비교 대상이 없어 표본이 절대적으로 부족한 것이었습니다.
이러한 문제에 직면했을 때 저는 우선순위를 두어 일을 처리했습니다. 먼저, 여행의 직구 서비스를 이용한 뒤 플랫폼의 UI, UX, 콘텐츠의 질과 양 등의 정보를 수집했으며, 지인들을 통해 고객들의 의견을 담은 설문조사로 부족한 표본을 보완해 나갔습니다. 이를 활용해 서비스 홍보 영상에 대한 시나리오 초안을 완성할 수 있었습니다. 예산과 관련해서는 여행의 직구 서비스에서만 판매하는 상품들을 영상 소품으로 활용하는 등 주변에 활용할 수 있는 자원과 상황들을 최대한 활용했습니다.
이러한 과정에서 매끄러운 업무 처리를 위해 정확한 자료를 수집하는 것과 상대가 원하는 것을 신속 정확하게 파악하고 제공해야 한다는 것이 프로젝트에 있어 얼마나 중요하고 필수적인지 직접 체득할 수 있었습니다. 2개의 홍보 영상은 서비스 공식 SNS 계정에 업로드 되었으며, 이를 통해 한정된 자원으로도 주변의 자원과 상황을 활용해 문제를 타개할 수 있는 능력을 키웠습니다. 저의 예산 활용 및 유기적인 상황 대처 역량은 현대백화점의 상품 및 서비스 기획에 대한 예산 편성과 회원 응대 등 전반적인 마케팅 업무에서 효율적으로 자원을 활용하는 데 유용하게 쓰일 것입니다.

"
협업/성과,마케팅 - 현대백화점,"다른 사람들이 당연하게 여겨 의식하지 못했던 비효율적인 것에 대해 문제를 제기하여 해결한 경험에 대해 기술해주세요. (문제인식 과정 및 문제라고 생각한 이유, 문제해결 과정, 그 과정에서 느낀점 등)","SK텔레콤 T프렌즈 활동 중 0브랜드와 관련하여 팀 단위로 홍보영상을 제작한 경험이 있습니다. 저희 팀은 “영상제작 방법과 장르”에 있어 기존에 행해지던 방식과 차별점을 두었습니다. 작성한 시나리오에 따라 영상을 제작하는 기존 방식과 다르게 기본 줄거리만 작성하고 작업을 수행하면서 시나리오를 수정하거나 아이디어를 제시하는 방법으로 살을 붙여 나갔습니다. 영상 장르에서도 일상 지향적이고 미래적인 분위기의 기존 SK텔레콤의 홍보물과는 다르게 B급 장르를 목표로 콘텐츠를 제작했습니다.
이는 영상 콘텐츠를 제작하는 데 주어진 시간이 한 달도 안되었다는 점이 컸으며, 콘텐츠 제작에 대한 팀원들의 성향이 저와 비슷했기 때문에 새로운 방식이 잘 적용되었습니다. 새로운 방식의 특성상 수시로 의견이 공유되어야 하기에 하루의 절반은 회의와 아이디어 기획에 시간을 할애할 수밖에 없었습니다. 우선 0브랜드의 서비스들을 분석한 결과 0캠퍼스의 데이터와 클라우드 서비스를 중점으로 콘텐츠의 목표를 설정했습니다. 팝아트 및 픽토그램 등의 CG와 EDM풍의 OST를 사용하여 B급 콘텐츠를 강조하였고, 0브랜드의 제품을 소품으로 사용해 브랜드를 강조하도록 영상의 구도를 설정했습니다.
이와 같은 노력으로 0브랜드 미션에서 최우수 콘텐츠에 선정되어 사내 홍보영상으로 사용되었으며 이는 제가 우수활동자로 수료하는 데 큰 영향을 끼쳤습니다. 기존의 방식과 어우러지면서 저만의 독창적인 방식으로 새로운 것들을 수용하는 저의 역량은 현대백화점의 사내 프로젝트에 새로운 활로를 불어넣어 시너지를 낼 것이며 이를 통해 저 자신도 성장하고 싶습니다.
"
협업/성과,마케팅 - 현대백화점,"서로 다른 사고방식이나 환경을 가진 사람들과 과제를 수행하면서 팀워크를 형성하기 위해 노력했던 경험에 대해 기술해주세요. (팀워크를 형성하려 했던 이유, 본인의 행동과 결과, 그 과정에서 느낀점 등)","롯데대학생서포터즈 U-프렌즈를 활동하는 중 다음 기수를 모집하는 홍보영상을 제작하는 팀 활동을 수행했습니다. 활동 초기 롯데플레져박스에 대한 홍보 영상을 팀 규모로 제작한 경험을 통해 영상 제작 활동은 촬영과 편집 등 다양한 역할을 혼자 맡아서 하기에 시간과 인력이 부족하다는 것을 판단했습니다.
우선 팀원들과 사전 회의를 진행했는데 영상 장르에 대해 의견을 나눈 결과 B급과 웹드라마로 장르가 나누어졌고 투표를 진행해 웹드라마로 장르를 결정했습니다. 저는 영상 편집에 대한 지식이 없어 편집 작업에 참여할 수 없었던 저는 대신 구상한 시나리오에 따라 촬영 장소를 선정하고 예산을 분배하는 역할을 맡았고 팀 활동비로 받은 20만원을 관리하여 장소를 대관하고 소품을 구매하는 데 사용했습니다.
모든 팀원들이 프로젝트에 대한 참여도는 높았지만, 장르에 있어 B급 감성 의견을 강력히 어필하는 팀원이 뜻을 굽히지 않아 시나리오 구상에 있어 차질이 발생했습니다. 저희 팀은 긴급회의를 열어 전제적인 방식은 웹드라마로 진행하되 영상 마지막 부분에 “밈” 형식의 영상을 추가하거나 몇몇 대사에 유머가 들어가도록 수정하는 방향으로 제안하였고 다행히 의견이 반영되어 무사히 영상 제작을 마칠 수 있었습니다.
많은 팀원들의 의견이 반영된 것에 비해 영상은 난잡하지 않고 자연스럽게 녹아들었고 준수한 퀄리티라는 점이 긍정적으로 평가받아 최우수 영상으로 선정되어 공식 SNS에 홍보영상으로 게시되었습니다. 이렇듯 상황에 따른 문제 대처 능력과 소통 역량을 향상시키고 실무에 필요한 역량을 키워나갈 수 있는 현대백화점의 인재로 성장하겠습니다."
기업/아이디어,마케팅 - 현대백화점,"평소 현대백화점(백화점, 아울렛, 더현대닷컴/현대식품관투홈 등 온라인몰)을 이용하며 느꼈던 장단점을 제시하고, 현대백화점의 경쟁력을 제고할 수 있는 아이디어를 제시하시오.","최근 더현대를 알아보면서 고객의 입장에서 장단점을 생각해 보았습니다. 여기서 제가 찾은 키 포인트는 바로 ""점포의 수"" 입니다. 동종업계 백화점들과 달리 더현대는 상대적으로 점포를 적게 보유하고 있지만, 점포 내 시그니처 브랜드가 점포의 희소성과 맞물려 ""고급화""라는 특성을 얻었습니다. 하지만, 16곳의 백화점과 8곳의 아울렛은 수치상으로도 적은 수이며, 대부분이 수도권과 영남에 몰려있다는 것은 고객 유치에 있어 불리하다는 것이 사실입니다.

""개성을 부여하여 '가심비' 잡기""
이를 통해 지점을 늘리는 것이 확실하겠지만 예산상으로도 갑작스러운 점포 확장은 불가능하며, 섣부른 지점 확장은 희소성을 통해 얻은 고급화 이미지를 잃을 수 있습니다. 그렇기에 저는 현재 운영중인 점포에 ""개성""을 부여하여 고객들이 매장을 직접 찾아오도록 만드는 것을 제안드리고자 합니다. 각 매장마다 지역의 특성을 살린 시그니처 콘크리트가 베스트 메뉴인 ""쉐이크쉑""처럼 각 지점과 지역의 특색을 적절히 결합하여 그 지역에만 존재하는 시그니처 점포를 만든다면 기존의 고급화 이미지와 시너지를 이룰 수 있다고 생각합니다. 
최근에는 가격이 아닌 심적 만족을 기준으로 삼는 ""가심비""가 주목받고 있어 서비스를 질적으로 향상시키는 것이 추세인 만큼 고객들이 안정감을 느끼거나 추억을 연상하도록 만드는 등 컨셉을 설정하여 심리적 욕구를 충족시키는 것이 더욱 효율적입니다. 이미 더현대 서울 및 현대백화점 판교점으로 컨셉을 명확히 잡은 플랫폼이 랜드마크로 자리잡은 경험이 있는 만큼 개성을 부여한 점포들을 운영한다면 충분히 경쟁력을 갖출 수 있을 것입니다."
협업/성과,자산 설계 전문가 - 신한은행,"공동의 목표 달성을 위해 구성원들과 협업하여 이루어낸 성과를 작성해 주세요. 구성원들과의 갈등상황이 있었다면 어떻게 극복하였는지, 팀워크 및 목표달성을 위해 본인은 어떠한 역할을 수행했는지 구체적으로 작성해 주세요.","[동반성장을 만드는 ‘리더’이자 ‘서포터’]
  관세청 정책기자 팀장을 역임했던 1년 동안 구성원과 팀의 성장 모두를 이루었습니다. 기자팀 팀장으로서 팀 성과 1위라는 목표를 제시하고 조직 업무 배치 및 개인 기사작성 관리 업무를 수행했습니다.
  업무를 배치할 때는 팀원의 성향을 고려하였습니다. 이는 업무 효율도를 높이는데 도움이 되었습니다. 그러나 '특송 통관' 카드뉴스를 제작할 때, 팀원 한 명이 팀에서 이탈하는 상황이 있었습니다. 분배된 업무에 대한 자신감 부족이 원인이었습니다. 저는 해당 팀원에게 업무를 재교육하여 다시 협력하는 관계를 만들었습니다. 이 경험을 통해 업무 분배에 더 신중을 기하게 되었습니다.
  또한, 개인의 성과가 모여 팀 성과를 만들어낸다는 믿음을 가지고 구성원의 개인 기사 작성을 도왔습니다. 전해 우수 기사로 선정된 글들을 공유하고, 법령 정보 포털 사용법을 안내했습니다. 그리고 솔선수범하여 연간 17건의 기사를 작성하고, 선착순으로 분배되는 취재권을 확보하여 팀원과 분배하였습니다.
  그 결과, 총 5회의 팀 프로젝트 중 4회에서 1등 성적을 거두었습니다. 그리고 팀원 중 한 명은 기자 공로를 인정받아 관세청장 표창을 받는 등 개인적 성장도 이룰 수 있었던 값진 경험이었습니다. 조직을 운영했던 이 경험을 통해, ‘리더’로서의 역할 뿐 아니라 동반 성장을 끌어내기 위한 ‘서포터’의 역할을 배울 수 있었습니다."
역량/경험,자산 설계 전문가 - 신한은행,지원한 직무를 수행하기 위해 필요한 핵심역량은 무엇이라고 생각하며 그 이유는 무엇인지 설명해 주세요.,"WM 직무를 수행하기 위해 갖춰야 할 역량은 크게 소통 능력과 전문성이라고 생각합니다. 그리고 은행원이 되기 위해 노력하는 과정에서 '소통'과 '전문성'에 대해 새로이 정의할 수 있었습니다.
소통은 고객과 자산 설계 상담을 할 때, 고객의 재무적, 비재무적 정보를 얻고자 경청하는 자세입니다. 상품을 안내하기 전 고객의 투자 성향 및 위험 감수 성향 등을 사전에 정확하게 파악해야 재무 목적을 달성할 수 있습니다. 
전문성은 고객에게 적합한 상품을 찾는 데 필요한 지식 함양과 스스로 더욱 발전하려는 마음가짐입니다. 행원은 경제 동향과 자산 시장, 투자에 대한 이해를 바탕으로 고객이 원하는 서비스를 제공해야 합니다. 더불어, 계속 발전해야 하는 이유는, 금융인에게는 수시로 변화하는 경제 동향과 금융법을 빠르게 파악하여 고객에게 최신 정보를 전달할 의무가 있기 때문입니다.
두 역량을 키우기 위한 자기개발은 자신에게 도움이 될 뿐 아니라 고객과 지점에도 긍정적 영향을 줄 것입니다."
역량/경험,자산 설계 전문가 - 신한은행,그 역량을 갖추기 위해 본인이 어떠한 노력을 기울였는지 구체적으로 기술해 주세요.,"첫째, 다양한 활동을 통해 소통 능력을 키웠습니다. 저는 약 2년간의 관세청 정책기자 생활과 3회의 단기 아르바이트 경험으로 해당 역량을 키웠습니다. 다양한 분야의 실무진에게 업무 협조를 요청하고, 취재 허가를 받는 과정에서 또렷한 목소리와 눈 맞춤을 통해 진정한 소통을 할 수 있었습니다. 더불어, 아르바이트할 때 고객이 불편하게 느낄 만한 점을 미리 찾아내어 개선해놓는 등 고객 만족을 실현하기 위해 노력한 바 있습니다.
둘째, WM 직무에 필요한 지식과 경험을 쌓고 있습니다. 신한금융그룹 금융아카데미 수강과 AFPK 공부를 병행하며 자산 설계의 필요성과 재무 설계사가 되기 위해서 갖추어야 하는 역량을 배우고 있습니다. 실제로 주식 투자를 해 보고 고객의 자산 포트폴리오를 만드는 실습을 하면서 실무를 간접적으로 경험하였습니다. 또한, 경제 동향 파악을 위해 시사잡지 및 신문을 구독하여 그 내용을 분석하는 시간을 가지고 있습니다."
동기/포부,자산 설계 전문가 - 신한은행,"지원한 분야에서 펼치고 싶은 꿈이 무엇인지, 그 꿈을 신한은행에서 이루고 싶은 이유는 무엇인지 구체적으로 기술해 주세요.","[미래를 위한 선택]
  자산 관리 필요성에 대한 인식은 해가 갈수록 증가하고 있습니다. 미래를 대비하고자 하는 사람들의 욕구가 반영된 것입니다. 신한은행은 두 가지 형태의 연금 플랜을 주력으로 하여 고객들에게 다양한 선택권을 제공하고 있습니다. 2014년 출범한 신한미래설계 은퇴브랜드는 신한금융그룹의 높은 신용도를 바탕으로 앞으로 많은 고객의 니즈를 만족시킬 수 있을 것입니다. 경제활동의 궁극적 목표인 안정적인 경제생활과 노후 자금 확보는 은행의 존재 이유라고 생각합니다. 
  신한은행에 PWM센터에 들어가 고객의 자산을 운용하고 설계하며 고객 행복과 자신의 성장, 두 마리 토끼를 모두 잡는 미래를 꿈꾸고 있습니다. 먼저, 일반 영업점에서 개인 금융 영업을 하며 대고객 커뮤니케이션 능력을 키우겠습니다. PWM센터는 금융상품뿐 아니라 증권상품도 함께 제시해야 하므로 금융투자분석사 자격을 취득하고, 최종적으로 CFP 자격을 취득하여 신한은행 최고의 자산 설계 전문가가 되겠습니다."
동기/포부,MD - CJ올리브영,지원동기,"어릴 때 얼굴에 아토피를 앓았던 사람으로서 올리브영은 제가 열망하는 두 가지의 집합입니다. 건강과 아름다움을 큐레이팅 한다는 비전은 그 어떤 회사보다 매력적입니다. 얼굴이 가렵고 아픈 것도 문제였지만 보기가 흉해 사람들 앞에 자신감 있게 나서기 어려웠습니다. 자연스럽게 또래 아이들에 비해 건강과 피부에 대한 관심을 일찍 가졌습니다. 좋다는 화장품과 약을 다 찾아 다녀본 적이 있습니다. 결핍되어 본적이 있던 사람의 시각으로 고객들이 원하는 상품을 기획하고 싶습니다.

기획부터 관리까지, 담당 카테고리를 온전히 저의 의도와 책임으로 결과를 내는 MD 직무는 매 단계 성취감을 느낄 수 있다고 생각합니다. MD는 모든 업무를 해내는 원더우먼이 되어야 하는 직무라고 생각합니다. 마케팅을 기본으로 소싱 시에 필요한 협상력, 종합적으로 상품을 보는 안목, 심미적인 역량과 실질적인 이익률 관리 등 그 어떤 직무보다 다양한 능력을 요구한다고 생각됩니다. 하나만 할 때보다 여러 가지 일을 동시에 할 때 더 좋은 결과를 도출해내는 제가 가장 에너지를 쏟을 수 있는 직무라 생각합니다.

올리브영에서 담당 카테고리 신제품을 기획할 시에 명확한 표적 시장선정을 토대로 타겟 고객층의 라이프스타일 분석을 통해 가장 어필될 수 있는 상품을 소싱하겠습니다. 소비하고 나가는 공간이 아닌 머무르며 소비하는 공간으로 만들고 싶습니다. 올리브영의 철학을 느낄 수 있는 공간으로서의 종합 뷰티 플랫폼을 만들고 싶습니다. 대형점포에서는 올리브영 제품 사용을 조건으로 한 미용실 및 뷰티점포를 입점 시켜 소비자들이 만족스러웠던 제품을 올리브영에서 재구매할수있는 One-stop 루트를 기획해보고 싶습니다. 또한 소형점포의 경우 매장 내 공간이 한정된 만큼 효율적인 운영을 위해 매출의 흐름을 바탕으로 한 트렌드 분석으로 SKU관리를 통해 최적 재고를 유지하겠습니다. 고마진 제품과 고회전율 제품의 적절한 조화를 통해 수익을 극대화하는 방법을 모색하겠습니다."
역량/경험,MD - CJ올리브영,"MD 직무 수행 시 필요한 역량은 무엇이라고 생각하며, 해당 역량을 갖추기 위해 그 동안 어떤 노력과 도전을 했나요? 그리고 그 과정에서 겪은 어려움과 극복과정을 구체적으로 설명해주세요.

","MD는 분석력, 통찰력을 기반으로한 전략에 능해야 한다고 생각합니다. 철저한 타켓시장 분석으로 상품 이미지 메이킹을 통해 고객의 욕구를 만족시킨다면 매출로 이어질 것입니다. 기존 매출과 재고 회전률을 분석하여 상품의 유지 및 추후 구매를 결정할 수 있습니다. 또한 주 고객인 20~30대 여성들의 라이프 스타일 분석과 최근의 뷰티 트렌드 분석을 매치하여 유의미한 결과를 가져올 수 있습니다. 추가적으로, 분석된 결과를 어떤 품목에 접목 시킬 시에 이익이 극대화될 수 있는지 판단 할 수 있는 통찰력이 필요합니다.

저는 2018년 11월, 세계에서 가장 큰 뷰티 전시회인 홍콩 COSMOPROF에서 한국 중소기업의 수출을 지원했습니다. 전시회 마지막 날, 사전에 상담이 약속된 바이어가 오지 않아 해당 기업의 실적이 저조하였습니다. 마지막 날이라 새로운 바이어를 발굴하기엔 시간이 촉박하였습니다. 제가 처한 상황에서 가장 최고의 결과를 낼 방법을 고민했습니다. BTB 성격의 전시회지만 일반 방문객이 많다는 점을 이용해 현장 판매를 제안했습니다.

먼저 기업 제품 분석을 통해 홍보 포인트를 찾았습니다. 화이트닝 앰플이 바르는 즉시 효과가 눈에 보인다는 점을 이용해, 화이트닝에 관심이 많은 동남아 고객들을 타겟으로 현장 완판을 기록했습니다. 제품 효과를 그 자리에서 느끼시도록 하였고 저희가 가져온 물량이 많지 않다는 점을 강조했습니다. 또한 부스의 위치가 외진 곳에 있어, 유동인구가 많은 곳으로 자리를 옮겨 지나가는 고객들의 손등에 마스크팩을 잘라 얹어주었습니다. 바이오셀룰로오스 시트의 특이한 촉감과 밀착력을 직접 경험 시켜 드렸습니다. 추가 구매를 원하시는 고객분들이 많아, 연락처를 기업 담당자분께 전달해드렸습니다.

철저히 상황을 분석하여 소비자의 니즈를 충족시킬 수 있는 방법을 고민했습니다. 주어진 상황을 바꿀 수 없다면, 그 안에서 최고의 결과를 끌어내기 위해 노력합니다. 바쁘게 돌아가는 현장이었지만 보람을 느낄 수 있는 경험이었습니다."
